{
  "$schema": "http://json-schema.org/draft-07/schema#",
  "$id": "https://example.invalid/schema/measure.schema.json",
  "title": "Ballot measure",
  "description": "One California statewide proposition or Santa Clara County ballot measure. This file is the single source of truth for the data shape: scripts/validate.mjs validates against it, so adding or changing a field means editing this file only.",
  "type": "object",
  "required": [
    "id",
    "jurisdiction",
    "election_date",
    "number",
    "title",
    "status",
    "summary",
    "what_it_really_means",
    "fiscal_impact",
    "taxes",
    "spending",
    "control_and_power",
    "loopholes",
    "unexpected_provisions",
    "pros",
    "cons",
    "nonpartisan_analysis",
    "sources",
    "last_updated"
  ],
  "properties": {
    "id": {
      "description": "Unique kebab-case identifier, also the output filename. Examples: ca-prop-1-2026, scc-measure-a-2026.",
      "type": "string",
      "minLength": 1,
      "pattern": "^[a-z0-9]+(-[a-z0-9]+)*$"
    },
    "jurisdiction": {
      "description": "Which ballot this measure appears on. Exactly \"state\" for a California statewide proposition, or \"county\" for a county measure.",
      "type": "string",
      "enum": ["state", "county"]
    },
    "county": {
      "description": "County name without the word \"County\", for example \"Santa Clara\". Required when jurisdiction is \"county\", omitted otherwise.",
      "type": "string",
      "minLength": 1
    },
    "election_date": {
      "description": "Date of the election this measure is on, as YYYY-MM-DD.",
      "type": "string",
      "pattern": "^[0-9]{4}-[0-9]{2}-[0-9]{2}$"
    },
    "number": {
      "description": "Display label as voters will see it on the ballot, for example \"Proposition 1\" or \"Measure A\".",
      "type": "string",
      "minLength": 1
    },
    "title": {
      "description": "Official short title of the measure.",
      "type": "string",
      "minLength": 1
    },
    "status": {
      "description": "Where the measure sits in the qualification and election process.",
      "type": "string",
      "enum": ["qualified", "pending", "on_ballot", "passed", "failed"]
    },
    "summary": {
      "description": "Two to three sentences of plain English describing what the measure does. Shown on the landing page card and at the top of the detail page.",
      "type": "string",
      "minLength": 1
    },
    "what_it_really_means": {
      "description": "The plain-language deep dive, one string per paragraph. This is the human-written analysis; nothing generates it.",
      "type": "array",
      "minItems": 1,
      "items": { "type": "string", "minLength": 1 }
    },
    "fiscal_impact": {
      "description": "The money picture, broken into the five figures voters ask about plus a narrative that ties them together.",
      "type": "object",
      "required": [
        "state_cost",
        "state_savings",
        "local_cost",
        "revenue_change",
        "ongoing_vs_one_time",
        "narrative"
      ],
      "properties": {
        "state_cost": {
          "description": "What the state pays, as a dollar figure or range, or \"none\".",
          "type": "string"
        },
        "state_savings": {
          "description": "What the state stops paying, as a dollar figure or range, or \"none\".",
          "type": "string"
        },
        "local_cost": {
          "description": "What cities, counties, and special districts pay, or \"none\".",
          "type": "string"
        },
        "revenue_change": {
          "description": "Net change in government revenue, with direction and rough size.",
          "type": "string"
        },
        "ongoing_vs_one_time": {
          "description": "Whether the costs and revenues above recur every year or land once.",
          "type": "string"
        },
        "narrative": {
          "description": "Longer explanation of the fiscal picture, including what the headline numbers leave out.",
          "type": "string"
        }
      }
    },
    "taxes": {
      "description": "Tax effects, separated into taxes that do not exist today and changes to taxes that do.",
      "type": "object",
      "required": ["new_taxes", "tax_changes"],
      "properties": {
        "new_taxes": {
          "description": "Taxes the measure creates. Empty array if it creates none.",
          "type": "array",
          "items": { "type": "string", "minLength": 1 }
        },
        "tax_changes": {
          "description": "Existing taxes the measure raises, lowers, extends, or redirects. Empty array if none.",
          "type": "array",
          "items": { "type": "string", "minLength": 1 }
        }
      }
    },
    "spending": {
      "description": "Where the money goes and where it comes from.",
      "type": "object",
      "required": ["new_spending_areas", "funding_source"],
      "properties": {
        "new_spending_areas": {
          "description": "Programs or categories that receive money under the measure. Empty array if none.",
          "type": "array",
          "items": { "type": "string", "minLength": 1 }
        },
        "funding_source": {
          "description": "Where the spending is paid from: bonds, general fund, a new tax, a redirected fund.",
          "type": "string"
        }
      }
    },
    "control_and_power": {
      "description": "Who gains authority, oversight, or control, and over whom. Name the body and what it can decide without further approval.",
      "type": "string",
      "minLength": 1
    },
    "loopholes": {
      "description": "Ambiguities, exemptions, and exploitable gaps in the text. Empty array if none found, but say so in the deep dive rather than leaving it unexamined.",
      "type": "array",
      "items": { "type": "string", "minLength": 1 }
    },
    "unexpected_provisions": {
      "description": "Riders and non-obvious items bundled in that a voter reading the title would not expect. Empty array if none.",
      "type": "array",
      "items": { "type": "string", "minLength": 1 }
    },
    "pros": {
      "description": "Arguments in favor, stated as a supporter would state them.",
      "type": "array",
      "minItems": 1,
      "items": { "type": "string", "minLength": 1 }
    },
    "cons": {
      "description": "Arguments against, stated as an opponent would state them.",
      "type": "array",
      "minItems": 1,
      "items": { "type": "string", "minLength": 1 }
    },
    "who_supports": {
      "description": "Named backers, with enough note to show why their support is informative.",
      "type": "array",
      "items": { "$ref": "#/definitions/party" }
    },
    "who_opposes": {
      "description": "Named opponents, with enough note to show why their opposition is informative.",
      "type": "array",
      "items": { "$ref": "#/definitions/party" }
    },
    "authors": {
      "description": "Who wrote or filed this measure: legislative authors/coauthors for a Legislature-referred measure, or proponents for an initiative. Optional.",
      "type": "array",
      "items": {
        "type": "object",
        "required": ["name", "role"],
        "properties": {
          "name": { "description": "Author's name.", "type": "string", "minLength": 1 },
          "role": {
            "description": "Their role on this measure, e.g. \"Lead Senate author\", \"Initiative proponent\".",
            "type": "string",
            "minLength": 1
          },
          "person_id": {
            "description": "Optional id of a matching file in content/people/, linking this name to a full profile page. Omit if no profile exists yet.",
            "type": "string",
            "pattern": "^[a-z0-9]+(-[a-z0-9]+)*$"
          }
        }
      }
    },
    "funding": {
      "description": "Money behind the campaign: registered committees, what they raised, and named donors where verifiable. Distinct from who_supports/who_opposes, which are public positions rather than money. Optional; omit entirely if no committee-finance data has been found.",
      "type": "object",
      "properties": {
        "support_committees": {
          "type": "array",
          "items": { "$ref": "#/definitions/committee" }
        },
        "oppose_committees": {
          "type": "array",
          "items": { "$ref": "#/definitions/committee" }
        }
      }
    },
    "nonpartisan_analysis": {
      "description": "Summaries from nonpartisan analysts such as the Legislative Analyst's Office or Ballotpedia. Empty array if none published yet.",
      "type": "array",
      "items": {
        "type": "object",
        "required": ["source", "summary", "url"],
        "properties": {
          "source": {
            "description": "Name of the analyzing body, for example \"Legislative Analyst's Office\".",
            "type": "string",
            "minLength": 1
          },
          "summary": {
            "description": "What that analysis concluded, in your own words.",
            "type": "string",
            "minLength": 1
          },
          "url": {
            "description": "Link to the analysis. Must be http or https to render as a link.",
            "type": "string",
            "minLength": 1
          }
        }
      }
    },
    "sources": {
      "description": "Primary sources the analysis rests on. scripts/fetch-sources.mjs archives every url listed here.",
      "type": "array",
      "minItems": 1,
      "items": {
        "type": "object",
        "required": ["title", "url", "retrieved"],
        "properties": {
          "title": {
            "description": "Human-readable name of the source document.",
            "type": "string",
            "minLength": 1
          },
          "url": {
            "description": "Link to the source. Must be http or https to render as a link.",
            "type": "string",
            "minLength": 1
          },
          "retrieved": {
            "description": "Date the source was read, as YYYY-MM-DD.",
            "type": "string",
            "pattern": "^[0-9]{4}-[0-9]{2}-[0-9]{2}$"
          }
        }
      }
    },
    "last_updated": {
      "description": "Date this file was last edited by a human, as YYYY-MM-DD.",
      "type": "string",
      "pattern": "^[0-9]{4}-[0-9]{2}-[0-9]{2}$"
    }
  },
  "if": {
    "properties": { "jurisdiction": { "const": "county" } },
    "required": ["jurisdiction"]
  },
  "then": {
    "required": ["county"]
  },
  "definitions": {
    "party": {
      "description": "A named supporter or opponent.",
      "type": "object",
      "required": ["name", "type"],
      "properties": {
        "name": {
          "description": "Name of the person or organization.",
          "type": "string",
          "minLength": 1
        },
        "type": {
          "description": "What kind of backer this is.",
          "type": "string",
          "enum": ["org", "politician", "business", "other"]
        },
        "notes": {
          "description": "Why this backer matters: funding, stake in the outcome, past positions.",
          "type": "string"
        }
      }
    },
    "committee": {
      "description": "A registered ballot-measure committee raising or spending money on this measure.",
      "type": "object",
      "required": ["name", "total_raised", "top_donors", "source_url"],
      "properties": {
        "name": {
          "description": "Official committee name.",
          "type": "string",
          "minLength": 1
        },
        "total_raised": {
          "description": "Total contributions, as a dollar figure or \"not yet reported\".",
          "type": "string",
          "minLength": 1
        },
        "top_donors": {
          "description": "Named donors with amounts, where a reliable donor-level breakdown was found. Empty array if none found — never fabricate a donor or amount.",
          "type": "array",
          "items": {
            "type": "object",
            "required": ["name", "amount"],
            "properties": {
              "name": { "type": "string", "minLength": 1 },
              "amount": { "type": "string", "minLength": 1 }
            }
          }
        },
        "source_url": {
          "description": "Where the finance figures came from: Cal-Access, FPPC, or the committee's own filing.",
          "type": "string",
          "minLength": 1
        }
      }
    }
  }
}
